,title,year,duration,description,genre,country
126,Дангал. Слово борца,2016,2h 41m,"Махавир Сингх Фогат, бывший борец, решает осуществить свою мечту о завоевании золотой медаль для своей страны, обучая своих дочерей для Игр Содружества, несмотря на существующие социальные стигмы.","Действие, биография, драма",India
127,Таксист,1976,1h 54m,"Мраво неуравновешенный ветеран работает ночным таксистом в Нью -Йорке, где воспринимаемый декаданс и подлости подпитывают его стремление к насильственным действиям.","Преступление, драма",United States
128,Гамильтон,2020,2h 40m,Реальная жизнь одного из главных отцов -основателей Америки и первого секретаря казначейства Александр Гамильтон. Захватил в прямом эфире на Бродвее из театра Ричарда Роджерса с оригинальным бродвейским актерским составом.,"Биография, драма, история",United States
129,Волк с Уолл-стрит,2013,3h,"Основываясь на истинной истории Джордана Белфорта, от его подъема до богатого фондового брокера, проживающего высокую жизнь до его падения, связанного с преступностью, коррупцией и федеральным правительством.","Биография, комедия, преступность",United States
130,Бэтмен: Начало,2005,2h 20m,"Свидев смерть своих родителей, миллиардер Брюс Уэйн узнает искусство борьбы, чтобы противостоять несправедливости. Когда он возвращается в Готэм в роли Бэтмена, он должен остановить секретное общество, которое намеревается уничтожить город.","Действие, преступность, драма",United States
131,Зеленая книга,2018,2h 10m,Итальянско-американский вышибала рабочего класса становится движущей силой афроамериканского классического пианиста в туре по местам по американскому югу 1960-х годов.,"Биография, комедия, драма",United States
132,На несколько долларов больше,1965,2h 12m,"Два убийцы наградных с аналогичными намерениями, но различные мотивы объединяются, чтобы выследить психотический мексиканский преступник, прежде чем он и его банда смогут выполнить смелое ограбление банка.","Драма, западный",Italy
133,Нюрнбергский процесс,1961,2h 59m,"Художественное изображение судей 1947 года, третье из 12 судебных процессов нацистских военных преступников, проведенных американскими оккупационными силами в Нюрнберге, Германия, в которых бывшие судьи нацистской Германии были предприняты для их действий.","Драма, война",United States
134,Шоу Трумана,1998,1h 43m,"Продавец страхования начинает подозревать, что вся его жизнь на самом деле является своего рода реалити -шоу.","Комедия, драма",United States
135,В джазе только девушки,1959,2h 1m,"После того, как два музыканта-мужчины стали свидетелями хита толпы, они бежат от государства в группе, замаскированной как женщины, замаскированной как женщины, но возникают дальнейшие осложнения.","Комедия, музыка, романтика",United States
136,Остров проклятых,2010,2h 18m,"Два американских маршала отправляются в психиатрическое учреждение на негостеприимном острове, чтобы исследовать исчезновение пациента.","Драма, Тайна, Триллер",United States
137,Малыш,1921,1h 8m,"Бродяга заботится о брошенном ребенке, но события подвергают их отношениям их отношения.","Комедия, драма, семья",United States
138,Отец,2020,1h 37m,"Мужчина отказывается от всей помощи от своей дочери, когда он стареет. Когда он пытается понять, что происходит вокруг него, он начинает сомневаться в своих близких, его собственном уме и даже ткани его реальности.","Драма, тайна",United Kingdom
139,Всё о Еве,1950,2h 18m,"Казалось бы, робкая, но тайно безжалостная Инжене вмешается в жизнь стареющей звезды Бродвея и ее круга театральных друзей.",Драма,United States
140,Парк юрского периода,1993,2h 7m,"Промышленник приглашает некоторых экспертов посетить его тематический парк клонированных динозавров. После сбоя сил существа убегают, впадая в опасность, в том числе его внуки.","Действие, приключение, научная фантастика",United States
141,Нефть,2007,2h 38m,"История семьи, религии, ненависти, нефти и безумия, сосредоточенная на разведчике на рубеже веков в первые дни бизнеса.",Драма,United States
142,Казино,1995,2h 58m,"В Лас-Вегасе два лучших друзья-исполнительный директор казино и мафиозный сияющий-скомплектируются империей азартных игр и быстроживущем, быстро любящем светском происхождении.","Преступление, драма",United States
143,Шестое чувство,1999,1h 47m,"После того, как его застрелил бывшим пациентом, которого он не смог помочь, детский психолог из Филадельфии ищет искупления, обращаясь к молодому мальчику с тревожным секретом.","Драма, Тайна, Триллер",United States
144,Ран,1985,2h 40m,"В средневековой Японии пожилой военачальник уходит на пенсию, передавая свою империю своим трем сыновьям. Тем не менее, он значительно недооценивает, как вновь обретенная сила испортит их, и заставит их поворачивать друг друга ... и его.","Действие, драма, война",Japan
145,Топ Ган. Мэверик,2022,2h 10m,"История связана с тем, что Маверик противостоит своему прошлому во время обучения группы молодых выпускников высшего оружия, в том числе сына его покойного лучшего друга, для опасной миссии.","Действие, драма",United States
146,Старикам тут не место,2007,2h 2m,"Насилие и хаос заступают после того, как охотник наткнулся на последствия сделки с наркотиками, и более двух миллионов долларов наличными возле Рио -Гранде.","Преступление, драма, триллер",United States
147,Нечто,1982,1h 49m,"Исследовательская группа в Антарктиде охотится на инопланетянин, изменяющий форму, который предполагает появление своих жертв.","Ужас, тайна, научная фантастика",United States
148,Лабиринт Фавна,2006,1h 58m,"В 1944 году Испания послала девушку жить со своим безжалостным отчимом. Ночью она встречает фею, которая ведет ее к старому фаун. Он говорит ей, что она принцесса, но должна доказать свою королевскую власть, пережив три ужасных задачи.","Драма, фантазия, война",Mexico
149,Непрощенный,1992,2h 10m,"Острый Уэст -Уэст -Ганслингер в отставке неохотно берет на себя последнюю работу, чтобы отомстить за несправедливость с помощью своего старого партнера и более нового преступника, известного просто как ребенок Шофилда.","Драма, западный",United States
150,Игры разума,2001,2h 15m,"Математический гений, Джон Нэш сделал удивительное открытие в начале своей карьеры и стоял на грани международного признания. Но красивый и высокомерный Нэш вскоре оказался в душераздирающем путешествии самопознания.","Биография, драма, тайна",United States
151,Убить Билла. Фильм 1,2003,1h 51m,"Проснувшись от четырехлетней комы, бывший убийца отомстил от команды убийц, которые ее предали.","Действие, преступность, триллер",United States
152,Сокровища Сьерра Мадре,1948,2h 6m,"Два американца в духе, ищущие работу в 1920-х годах Мексики, убедили старого разведчика помочь им добывать золото в горах Сьерра-Мадре.","Приключение, драма, западная",United States
153,Пленницы,2013,2h 33m,"Отчаянный отец берет закон в свои руки после того, как полиция не сможет найти двух похищенных девушек.","Преступление, драма, тайна",United States
154,Телохранитель,1961,1h 50m,"Хитрый Ронин приходит в город, разделенный двумя преступными бандами, и решает сыграть их друг против друга, чтобы освободить город.","Действие, драма, триллер",Japan
155,В поисках Немо,2003,1h 40m,"После того, как его сын запечатлен в Большом Барьерном рифе и доставлен в Сидней, робкая рыба -клоуна отправляется в путешествие, чтобы привести его домой.","Анимация, приключения, комедия",United States
156,Большой побег,1963,2h 52m,"Союзные офицеры в немецком лагере военнопленного во время Второй мировой войны создают смелый план массового побега сотнями своих людей, надеясь вытащить немецкий персонал и ресурсы вдали от боевых операций.","Приключение, драма, триллер",United States
157,Ходячий замок,2004,1h 59m,"Когда неуверенная молодая женщина проклята старым телом злобной ведьмой, ее единственный шанс нарушить заклинание лежит с самодовольным, но небезопасным молодым волшебником и его спутниками в его ноже, ходячий замок.","Анимация, приключения, семья",Japan
158,Монти Пайтон и священный Грааль,1975,1h 31m,"Король Артур и его рыцари круглого стола отправляются в сюрреалистический, малобюджетный поиск Святого Грааля, встречающего много, очень глупые препятствия.","Приключение, комедия, фантазия",United Kingdom
159,Человек-слон,1980,2h 4m,"Викторианский хирург спасает сильно изуродованного человека, которому плохо обращается, когда собираясь на жизнь как урод с боковым шоу. За его чудовищным фасадом обнаружен человек доброты, интеллекта и изысканности.","Биография, драма",United States
160,В случае убийства набирайте «М»,1954,1h 45m,"Лондонский плейбой представляет идеальное убийство его богатой, неверной жены.","Преступление, драма, тайна",United States
161,Унесенные ветром,1939,3h 58m,"Закрытая и манипулятивная южная Белль и рогусский спекулятор сталкиваются с турбулентным романом, когда общество вокруг них рушатся с концом рабства и восстанавливается во время гражданской войны и периодов реконструкции.","Драма, романтика, война",United States
162,Клаус,2019,1h 36m,"Простой акт доброты всегда вызывает другой, даже в замороженном, далеком месте. Когда новый почтальон Смиеренсбурга, Джеспер, подружился с игрушками Клауса, их подарки растают вековую вражду и доставляют сами, полные праздничных традиций.","Анимация, приключения, комедия",Spain
163,Расёмон,1950,1h 28m,"Изнасилование невесты и убийство ее мужа -самураев вспоминаются с точек зрения бандита, невесты, призрака самураев и деревянного штампа.","Преступление, драма, тайна",Japan
164,Китайский квартал,1974,2h 10m,"Частный детектив, нанятый для разоблачения прелюбодея в 1930 -х годах, Лос -Анджелес оказывается в том, что он попал в сеть обмана, коррупции и убийства.","Драма, Тайна, Триллер",United States
165,Тайна в его глазах,2009,2h 9m,"Отставной юрисконсульт пишет роман в надежде найти закрытие для одного из его прошлых неразрешенных дел об убийстве, а также за его неразрешившую любовь к его начальнику - оба из которых все еще преследуют его десятилетия спустя.","Драма, тайна, романтика",Argentina
166,"Карты, деньги, два ствола",1998,1h 47m,"Когда четыре мелких преступника проигрывают сфальсифицированную игру в покер против лондонского короля, он дает им одну неделю, чтобы урегулировать их огромный долг.","Комедия, преступность",United Kingdom
167,«V» значит Вендетта,2005,2h 12m,"В будущем Британском антиутопическом обществе, темный боец ​​свободы, известный только псевдонимом «V», предназначен для свержения тиранического правительства - с помощью молодой женщины.","Действие, драма, научная фантастика",United States
168,Головоломка,2015,1h 35m,"После того, как молодая Райли вырвана из своей жизни на Среднем Западе и переехала в Сан -Франциско, ее эмоции - радость, страх, гнев, отвращение и грусть - конфликт с тем, как лучше всего ориентироваться в новом городе, доме и школе.","Анимация, приключения, комедия",United States
169,"Три билборда на границе Эббинга, Миссури",2017,1h 55m,"Мать лично бросает вызов местным властям раскрыть убийство своей дочери, когда они не могут поймать виновника.","Комедия, преступность, драма",United Kingdom
170,Мост через реку Квай,1957,2h 41m,"Британские военнопленные вынуждены построить железнодорожный мост через реку Кваи для своих японских похитителей в оккупированной Бирме, не зная, что союзные силы планируют смелый набег на коммандос через джунгли, чтобы уничтожить его.","Приключения, драма, война",United Kingdom
171,На игле,1996,1h 33m,"Рентон, глубоко погруженный на сцену наркотиков в Эдинбурге, пытается убрать и выйти, несмотря на очарование наркотиков и влияние друзей.",Драма,United Kingdom
172,Дикий робот,2024,1h 42m,"После кораблекрушения умный робот под названием Роз оказался на необитаемом острове. Чтобы выжить в суровой среде, Роз связывается с животными острова и заботится о детском гусь с сиротом.","Анимация, научная фантастика",United States
173,"Поймай меня, если сможешь",2002,2h 21m,"Еще 17 еще 17, Фрэнк - опытный фальсификатор, который прошел в качестве врача, адвоката и пилота. Агент ФБР Карл становится одержимым отслеживанием мошенника, который только наслаждается преследованием.","Биография, преступность, драма",United States
174,Бешеный бык,1980,2h 9m,"Жизнь боксера Джейка Ламотты, чье насилие и характер, которые привели его к вершине на ринге, разрушила его жизнь вне его.","Биография, драма, спорт",United States
175,Фарго,1996,1h 38m,"Продавец автомобилей Миннесоты Джерри Ландегаард непредубеляется из -за того, что он и его приспешники сражаются и постоянную полицейскую работу довольно беременной Мардж Гандерсон.","Преступление, драма, триллер",United Kingdom
176,Воин,2011,2h 20m,"Младший сын бывшего боксера -алкоголика возвращается домой, где он обучен своим отцом для соревнований в турнире по смешанным боевым искусствам - пути, который ставит бойца на курс столкновения со своим отчужденным старшим братом.","Действие, драма, спорт",United States
177,Гарри Поттер и Дары смерти: Часть II,2011,2h 10m,"По мере того, как битва между силами добра и зла в волшебном мире экранируется, Гарри Поттер приближается к своему последнему противостоянию с Волдемортом.","Приключение, семья, фантазия",United Kingdom
178,Гран Торино,2008,1h 56m,"После того, как подросток хмонга пытается украсть свой ценный Gran Torino 1972 года, недовольный, предвзятый ветеран Корейской войны стремится искупить и мальчика, и его себя.",Драма,Germany
179,Малышка на миллион,2004,2h 12m,"Фрэнки, злоупотребленный старым тренером, неохотно соглашается обучить начинающего боксера Мэгги. Впечатленная ее решимостью и талантом, он помогает ей стать лучшей, и они вскоре составляют тесную связь.","Драма, спорт",United States
180,Мой сосед Тоторо,1988,1h 26m,"Когда две девушки переезжают в страну, чтобы быть рядом с своей больной матерью, у них есть приключения с чудесными лесными духами, которые живут поблизости.","Анимация, комедия, семья",Japan
181,Безумный Макс: Дорога ярости,2015,2h,"В постсапокалиптической пустоши женщина повстанцает против тиранического правителя в поисках своей родины с помощью группы женских заключенных, психотического поклонника и дрифтера по имени Макс.","Действие, приключение, научная фантастика",Australia
182,Бен-Гур,1959,3h 32m,"Еврейский принц предан и отправлен в рабство римским другом в Иерусалиме 1-го века, но вскоре он восстановит свою свободу и вернется за мести.","Приключение, драма",United States
183,Человек-паук: Нет пути домой,2021,2h 28m,"Теперь, когда личность Человека-паука раскрыта, Питер просит доктора Стрэнджа о помощи. Когда заклинание идет неправильно, начинают появляться опасные враги из других миров.","Действие, приключение, фантазия",United States
184,Барри Линдон,1975,3h 5m,Ирландский мошенник выигрывает сердце богатой вдовы и занимает аристократическую должность ее мертвого мужа в Англии 18-го века.,"Приключения, драма, война",United Kingdom
185,Дети небес,1997,1h 29m,"После того, как мальчик теряет пару туфель своей сестры, он отправляется в серию приключений, чтобы найти их. Когда он не может, он пробует новый способ «выиграть» новую пару.","Драма, семья, спорт",Iran
