,title,year,duration,description,genre,country
0,Побег из Шоушенка,1994,2h 22m,"Банкир, осужденный за уксорицид, образует дружбу за четверть века с закаленным осужденным, сохраняя при этом его невиновность и пытаясь оставаться надежды на простое сострадание.",Драма,United States
1,Крестный отец,1972,2h 55m,Старение патриарха организованной криминальной династии передает контроль над его тайной империей его неохотному сыну.,"Преступление, драма",United States
2,Тёмный рыцарь,2008,2h 32m,"Когда угроза, известная как Джокер, наносит ущерб и хаос народах Готэма, Бэтмен, Джеймс Гордон и Харви Дент должны работать вместе, чтобы положить конец безумию.","Действие, преступность, драма",United States
3,Крестный отец 2,1974,3h 22m,"Ранняя жизнь и карьера Вито Корлеоне в 1920 -х годах изображаются, в то время как его сын Майкл расширяет и подтягивает свою власть в отношении синдиката по семейной преступности.","Преступление, драма",United States
4,12 разгневанных мужчин,1957,1h 36m,"Присяжные в суде по делу об убийстве в Нью -Йорке разочарованы одним членом, чей скептически осторожность заставляет их более тщательно рассмотреть доказательства, прежде чем принять поспешное приговор.","Преступление, драма",United States
5,Властелин колец: Возвращение короля,2003,3h 21m,"Гандальф и Арагорн ведут мир людей против армии Саурона, чтобы привлечь свой взгляд от Фродо и Сэма, когда они приближаются к Маунт -Дум с одним кольцом.","Приключения, драма, фантазия",New Zealand
6,Список Шиндлера,1993,3h 15m,"В оккупированной немецкой Поль году во время Второй мировой войны промышленный Оскар Шиндлер постепенно заинтересован в своей еврейской рабочей силе после того, как нацисты были свидетелем их преследования со стороны нацистов.","Биография, драма, история",United States
7,Криминальное чтиво,1994,2h 34m,"Жизнь двух наемников толпы, боксера, гангстера и его жены, и пары закусочных бандитов переплетаются в четырех сказках о насилии и искуплении.","Преступление, драма",United States
8,Властелин колец: Братство кольца,2001,2h 58m,"Крутый хоббит из Шира и восемь компаньонов отправился в путешествие, чтобы уничтожить мощное кольцо и спасти Средиземье от Темного лорда Саурона.","Приключения, драма, фантазия",New Zealand
9,"Хороший, плохой, злой",1966,2h 41m,"Мошенничество на щедрости присоединяется к двум мужчинам в непростительном союзе против третьего в гонке, чтобы найти целое состояние в золоте, похороненное на отдаленном кладбище.","Приключение, западный",Italy
10,Форрест Гамп,1994,2h 22m,"История Соединенных Штатов с 1950 -х годов до 70 -х годов разворачивается с точки зрения мужчины из Алабамы с IQ из 75 лет, который жаждет воссоединиться со своей детской возлюбленной.","Драма, роман",United States
11,Властелин колец: Две крепости,2002,2h 59m,"В то время как Фродо и Сэм Эдж ближе к Мордору с помощью Shifty Gollum, разделенное общение выступает против нового союзника Саурона, Сарумана и его полщиков Исигарда.","Приключения, драма, фантазия",New Zealand
12,Бойцовский клуб,1999,2h 19m,"Офисный работник бессонницы и производитель мыльной помощи дьяволам образуют подземный бой-клуб, который превращается в гораздо больше.","Преступление, драма, триллер",Germany
13,Начало,2010,2h 28m,"Вор, который крадет корпоративные секреты благодаря использованию технологии обмена мечтами, дает обратную задачу посадки идеи в сознание C.E.O., но его трагическое прошлое может обречь проект и его команду в катастрофу.","Действие, приключение, научная фантастика",United States
14,Звёздные войны: Эпизод 5 - Империя наносит ответный удар,1980,2h 4m,"После того, как Империя одолевает альянс повстанцев, Люк Скайуокер начинает тренироваться с мастером Джедай Йода, в то время как Дарт Вейдер и охотник за головами Боба Фетт преследуют своих друзей через галактику.","Действие, приключение, фантазия",United States
15,Матрица,1999,2h 16m,"Когда прекрасный незнакомец приводит компьютерного хакера Нео к запрещенному подземному миру, он обнаруживает шокирующую правду-жизнь, которую он знает,-это сложный обман злой кибер-интеллекты.","Действие, научная фантастика",United States
16,Славные парни,1990,2h 25m,"История Генри Хилла и его жизни в мафии, освещая его отношения с его женой Карен и его партнерами по толпике Джимми Конвея и Томми Девито.","Биография, преступность, драма",United States
17,Пролетая над гнездом кукушки,1975,2h 13m,Недавно принятый психиатрический пациент помогает своим послушным компаньонам бросить тираническую медсестру.,Драма,United States
18,Интерстеллар,2014,2h 49m,"Когда в будущем Земля станет необитаемой, фермеру и бывшему пилоту на NASA Джозеф Купер поручено пилотировать космический корабль вместе с командой исследователей, чтобы найти новую планету для людей.","Приключение, драма, научная фантастика",United States
19,Семь,1995,2h 7m,"Два детектива, новичок и ветеран, охотятся на серийного убийцы, который использует семь смертельных грехов в качестве своих мотивов.","Преступление, драма, тайна",United States
20,Эта замечательная жизнь,1946,2h 10m,"Ангела посылают с небес, чтобы помочь отчаянно разочарованному бизнесмену, показав ему, какая жизнь была бы, если бы он никогда не существовал.","Драма, семья, фантазия",United States
21,Семь самураев,1954,3h 27m,"Фермеры из деревни, эксплуатируемой бандитами, нанимают ветеран -самурай для защиты, и он собирает шесть других самураев, чтобы присоединиться к нему.","Действие, драма",Japan
22,Молчание ягнят,1991,1h 58m,"Молодой Ф.Б.И. Ка курсант должен получить помощь в заключении и манипулятивном убийце каннибала, чтобы помочь поймать другого серийного убийцы, сумасшедшего, который скорее пострадает.","Преступление, драма, ужас",United States
23,Спасти рядового Райана,1998,2h 49m,"После посадки в Нормандии группа солдат США идет за вражеской линии, чтобы забрать десантник, чьи братья были убиты в бою.","Драма, война",United States
24,Город Бога,2002,2h 10m,"В трущобах Рио два детских путях расходятся, когда один из них пытается стать фотографом, а другой - королем.","Преступление, драма",Brazil
25,Зелёная миля,1999,3h 9m,"Смертельный охранник узнает, что нежный гигант в его атаке обладает таинственным подарком.","Преступление, драма, фантазия",United States
26,Жизнь прекрасна,1997,1h 56m,"Когда открытый еврейский официант и его сын становятся жертвами Холокоста, он использует идеальную смесь воли, юмора и воображения, чтобы защитить своего сына от опасностей вокруг их лагеря.","Комедия, драма, романтика",Italy
27,Терминатор 2: Судный день,1991,2h 17m,"Киборг, идентичный тем, кто не смог убить Сару Коннор, теперь должен защитить своего десятилетнего сына Джона от еще более продвинутого и могущественного киборга.","Действие, приключение, научная фантастика",United States
28,Звёздные войны,1977,2h 1m,"Люк Скайуокер объединяет усилия с рыцарем-джедаем, дерзким пилотом, вуки и двумя дроидами, чтобы спасти галактику от боевой станции Империи, а также пытается спасти принцессу Лею от таинственного Дарта Вейдера.","Действие, приключение, фантазия",United States
29,Назад в будущее,1985,1h 56m,"Марти МакФлай, 17-летний ученик средней школы, случайно отправил 30 лет в прошлое в путешествии во времени Делореан, изобретенного его близким другом, научным сотрудником Доком Брауном.","Приключение, комедия, научная фантастика",United States
30,Унесённые призраками,2001,2h 4m,"Во время переезда своей семьи в пригороды угрюмая 10-летняя девочка бродит в мир, которым управляют боги, ведьмы и духи, и где люди превращаются в зверей.","Анимация, приключения, семья",Japan
31,Пианист,2002,2h 30m,"Во время Второй мировой войны известный польский музыкант Wladyslaw сталкивается с различной борьбой, поскольку он теряет контакт со своей семьей. Когда ситуация ухудшается, он прячется в руинах Варшавы, чтобы выжить.","Биография, драма, музыка",France
32,Гладиатор,2000,2h 35m,"Бывший римский генерал намерен точно месть против коррумпированного императора, который убил его семью и отправил его в рабство.","Действие, приключение, драма",United States
33,Паразиты,2019,2h 12m,Жадность и дискриминация класса угрожают недавно сформированным симбиотическим отношениям между богатой семьей парка и обездоленным кланом Ким.,"Драма, триллер",South Korea
34,Психо,1960,1h 49m,"Секретарь по прибеганию к растрату укрывается в уединенном калифорнийском мотеле, принадлежащем подавленному человеку и его властной матери.","Драма, ужас, тайна",United States
35,Король Лев,1994,1h 28m,"Принц Лев Симба и его отец подвергаются нападению его горького дяди, который хочет подняться на престол.","Анимация, приключения, драма",United States
36,Могила светлячков,1988,1h 28m,Молодой мальчик и его младшая сестра изо всех сил пытаются выжить в Японии во время Второй мировой войны.,"Анимация, драма, война",Japan
37,Отступники,2006,2h 31m,"Полицейский под прикрытием и родинка в полиции пытаются идентифицировать друг друга, проникнув в ирландскую банду в Южном Бостоне.","Преступление, драма, триллер",United States
38,Одержимость,2014,1h 46m,"Многообещающий молодой барабанщик записывается в музыкальную консерваторию, где его мечты о величии обучаются инструктором, который не остановится ни перед чем, чтобы реализовать потенциал студента.","Драма, музыка",United States
39,Харакири,1962,2h 13m,"Когда Ронин, прося Сеппуку во дворце феодального лорда, рассказывается о жестоком самоубийстве другого Ронина, который ранее посещал, он раскрывает, как их прошлые переплетаются - и при этом бросают вызов целостности клана.","Драма, тайна",Japan
40,Американская история Икс,1998,1h 59m,"Живая жизнью, отмеченная насилием, Неонацистский Дерек, наконец, отправляется в тюрьму после убийства двух чернокожих молодых людей. После его освобождения Дерек клянется измениться; Он надеется не допустить, чтобы его брат Дэнни, который боготворивает Дерека, следовать по его стопам.","Преступление, драма",United States
41,Престиж,2006,2h 10m,Соперничающие маги 19-го века вступают в горькую битву за коммерческие секреты.,"Драма, Тайна, научная фантастика",United Kingdom
42,Леон,1994,1h 50m,Итальянский хит -мужчина защищает нью -йоркскую сироту.,"Действие, преступность, драма",France
43,Человек-паук: Паутина вселенных,2023,2h 20m,"Путешествуя по мультивселенной, Майлз Моралес встречает новую команду пауков, состоящую из героев из разных измерений. Но когда герои сталкиваются с тем, как справиться с новой угрозой, Майлз оказывается на перекрестке.","Анимация, действие, приключение",United States
44,Касабланка,1942,1h 42m,"Циничный экспатриант американский владелец кафе изо всех сил пытается решить, помогать ли его бывшему любовнику и ее бегтерцу избежать нацистов во французском Марокко.","Драма, романтика, война",United States
45,Подозрительные лица,1995,1h 46m,"Единственный выживший в результате перестрелки пирса рассказывает историю о том, как пресловутый преступник повлиял на события, которые начались с пяти преступников, собравшихся в кажущейся случайной полицейской линейке.","Преступление, драма, тайна",United States
46,1+1,2011,1h 52m,"После того, как он становится четырехлетним из аварии на парапланеринге, аристократ нанимает молодого человека из проектов, чтобы он был его попечителем.","Комедия, драма",France
47,Новый кинотеатр «Парадизо»,1988,2h 54m,"Сальваторе, известный режиссер, возвращается в свой родной город на похороны резокриста местного театра Альфредо. Он вспоминает о своей жизни, когда молодой мальчик влюбился в кино.","Драма, роман",Italy
48,Новые времена,1936,1h 27m,Бродяга изо всех сил пытается жить в современном промышленном обществе с помощью молодой бездомной женщины.,"Комедия, драма, романтика",United States
49,Чужой,1979,1h 57m,После изучения таинственной передачи неизвестного происхождения экипаж коммерческого космического корабля встречает смертельную форму жизни.,"Ужас, научная фантастика",United Kingdom
50,Окно во двор,1954,1h 52m,"Скучный фотограф, выздоравливающий от сломанной ноги, проходит время, наблюдая за своими соседями и начинает подозревать одного из них об убийстве.","Драма, Тайна, Триллер",United States
51,Однажды на Диком Западе,1968,2h 46m,"Загадочный незнакомец с гармоникой объединяет усилия с печально известным отчаянием, чтобы защитить прекрасную вдову от безжалостной убийцы, работающей на железной дороге.","Драма, западный",Italy
52,Джанго освобождённый,2012,2h 45m,"С помощью немецкой охотника за щедрости, освобожденный раб, который собирается спасти свою жену от жестокого владельца плантации в Миссисипи.",Западный,United States
53,Огни большого города,1931,1h 27m,"С помощью богатого беспорядочного Tippler, бродяги с влажными глазами, который влюбился в невидимую цветочную девушку, накапливает деньги, чтобы помогать ей медицинской помощи.","Комедия, драма, романтика",United States
54,Апокалипсис сегодня,1979,2h 27m,"Офицеру армии США, служащего во Вьетнаме, поручено убийством полковника спецназа Renegade, который считает себя Богом.","Драма, тайна, война",United States
55,Дюна: Часть вторая,2024,2h 46m,"Пол Атрейдес объединяется с Фременом, находясь на пути мести, отомстив заговорщикам, которые уничтожили его семью. Столкнувшись с выбором между любовью всей его жизни и судьбой вселенной, он старается предотвратить ужасное будущее.","Действие, приключение, драма",United States
56,Помни,2000,1h 53m,"Бывший страховой следователь, который сейчас страдает от антероградной амнезии, использует заметки и татуировки, чтобы выследить убийцу своей жены.","Тайна, триллер",United States
57,ВАЛЛ·И,2008,1h 38m,"Робот, который отвечает за очистку покрытой отходом земля, встречает другого робота и влюбляется в нее. Вместе они отправились в путешествие, которое изменит судьбу человечества.","Анимация, приключения, семья",United States
58,Индиана Джонс: В поисках утраченного ковчега,1981,1h 55m,"В 1936 году археологи и авантюристы правительства США наняли Индиана Джонс, чтобы найти Ковчег Завета, прежде чем нацисты смогли получить свои необычайные полномочия.","Действие, приключение",United States
59,Жизнь других,2006,2h 17m,"В 1984 году в Восточном Берлине агент секретной полиции, проводящего наблюдение за писателем и его любовником, становится все более поглощенным своей жизнью.","Драма, Тайна, Триллер",Germany
60,Мстители: Война бесконечности,2018,2h 29m,"Мстители и их союзники должны быть готовы пожертвовать всеми в попытке победить могущественных Таноса, прежде чем его блиц разрушительного и руина положит конец вселенной.","Действие, приключение, научная фантастика",United States
61,Сансет бульвар,1950,1h 50m,"Сценарист развивает опасные отношения с выцветшей кинозвездой, решившей, чтобы сделать триумфальное возвращение.","Драма, кино-ноар",United States
62,Человек-паук: Через Вселенные,2018,1h 57m,"Teen Miles Morales становится Человеком-пауком своей вселенной и должен присоединиться к пять человек с пауками из других измерений, чтобы остановить угрозу для всех реалий.","Анимация, действие, приключение",Canada
63,Тропы славы,1957,1h 28m,"Полковник защищает трех своих солдат в военном суде после того, как они отказываются от суицидальной атаки.","Драма, война",United States
